{
  "issuer": "http://localhost:8090/tsf-idp",
  "authorization_endpoint": "http://localhost:8090/tsf-idp/authorize",
  "token_endpoint": "http://localhost:8090/tsf-idp/token",
  "jwks_uri": "http://localhost:8090/tsf-idp/.well-known/jwks.json",
  "response_types_supported": [
    "code"
  ],
  "subject_types_supported": [
    "public"
  ],
  "id_token_signing_alg_values_supported": [
    "RS256"
  ],
  "code_challenge_methods_supported": [
    "S256"
  ],
  "grant_types_supported": [
    "authorization_code",
    "refresh_token",
    "client_credentials"
  ],
  "token_endpoint_auth_methods_supported": [
    "none",
    "client_secret_post"
  ]
}
